adrCleost,adresse,codePostal,ville,Statut,anneePubli,Domaine,Titre Article,Titre Journal,doi
217496123P55,"Univ Blaise Pascal, Univ Clermont Auvergne, Lab Phys Corpusculaire, CNRS IN2P3, Clermont Ferrand, France",,CLERMONT-FERRAND,C,2017,SMV,Search for anomalous electroweak production of WW/WZ in association with a high-mass dijet system in pp collisions at root S=8 TeV with the ATLAS detector,PHYS REV D,
217496201P95,"Univ Blaise Pascal, LPC, Clermont Univ, CNRS IN2P3, Clermont Ferrand, France",,CLERMONT-FERRAND,C,2017,SMV,Kaon femtoscopy in Pb-Pb collisions at root s(NN)=2.76 TeV,PHYS REV C,
217496204P5,"Univ Clermont Auvergne, UMR Microbiol Environm Digestif & Sante MEDiS, INRA, Site Theix, Clermont Ferrand, France",,CLERMONT-FERRAND,C,2017,SMV,Comparative subproteomic analysis of clinically acquired fluoroquinolone resistance and ciprofloxacin stress in Salmonella Typhimurium DT104B,PROTEOM C A,
217497796P5,"CNRS, Geolab UMR6042, F-63006 Clermont Ferrand, France",63006,CLERMONT-FERRAND,C,2017,SMV,Gully evolution and geomorphic adjustments of badlands to reforestation,SCI REP,
217497953P4,"Gabriel Montpied Univ Hosp, Med ICU, Clermont Ferrand, France",,CLERMONT-FERRAND,C,2017,SMV,Weekly high-dose liposomal amphotericin B (L-AmB) in critically ill septic patients with multiple Candida colonization: The AmBiDex study,PLOS ONE,
217497994P53,"Univ Clermont Auvergne, CNRS, IN2P3, LPC, Clermont Ferrand, France",,CLERMONT-FERRAND,C,2017,SMV,Femtoscopy with identified charged pions in proton-lead collisions at root s(NN)=5.02 TeV with ATLAS,PHYS REV C,
217500031P55,"Univ Clermont Auvergne, Phys Corpusculaire Lab, Clermont Ferrand, France",,CLERMONT-FERRAND,C,2017,SMV,A measurement of the calorimeter response to single hadrons and determination of the jet energy scale uncertainty using LHC Run-1 pp-collision data with the ATLAS detector,EUR PHY J C,
217500031P56,"Univ Blaise Pascal, CNRS, IN2P3, Clermont Ferrand, France",,CLERMONT-FERRAND,C,2017,SMV,A measurement of the calorimeter response to single hadrons and determination of the jet energy scale uncertainty using LHC Run-1 pp-collision data with the ATLAS detector,EUR PHY J C,
217501702P2,"Univ Clermont Auvergne, Clermont Ferrand, France",,CLERMONT-FERRAND,C,2017,SMV,Increased Adhesion of Listeria monocytogenes Strains to Abiotic Surfaces under Cold Stress,FRONT MICRO,
217501702P3,"Univ Clermont Auvergne, UMR MEDiS, INRA, St Genes Champanelle, France",,SAINT-GENES-CHAMPANELLE,C,2017,SMV,Increased Adhesion of Listeria monocytogenes Strains to Abiotic Surfaces under Cold Stress,FRONT MICRO,
217501727P1,"Univ Clermont Auvergne, INRA, MEDIS, F-63000 Clermont Ferrand, France",63000,CLERMONT-FERRAND,C,2017,SMV,OCaPPI-Db: an oligonucleotide probe database for pathogen identification through hybridization capture,DATABASE,
217501727P2,"Univ Auvergne, IUT Puy En Velay, Le Puy En Velay, France",,LE-PUY-EN-VELAY,C,2017,SMV,OCaPPI-Db: an oligonucleotide probe database for pathogen identification through hybridization capture,DATABASE,
217501727P3,"Univ Auvergne, ISIT, Clermont Ferrand, France",,CLERMONT-FERRAND,C,2017,SMV,OCaPPI-Db: an oligonucleotide probe database for pathogen identification through hybridization capture,DATABASE,
217501929P2,"INRA, UMR Genet Diversite & Ecophysiol Cereales 1095, 234 Ave Brezet, F-63100 Clermont Ferrand, France",63100,CLERMONT-FERRAND,NC,2017,SMV,Designing mixtures of varieties for multifunctional agriculture with the help of ecology. A review,AGRON SUSTA,
217501935P33,"CHU Clermont Ferrand, Memory Resource & Res Ctr Clermont Ferrand, F-63000 Clermont Ferrand, France",63000,CLERMONT-FERRAND,C,2017,SMV,Cognitive and imaging markers in non-demented subjects attending a memory clinic: study design and baseline findings of the MEMENTO cohort,ALZH RES TH,
217505052P10,"Univ Blaise Pascal, LPC, CNRS, IN2P3, F-63178 Aubiere, France",63178,AUBIERE,C,2017,SMV,Measurement of top quark polarization in t(t)over-bar lepton+jets final states,PHYS REV D,
217505581P6,"Univ Blaise Pascal, Clermont Univ, Genet Reprod & Dev, Clermont Ferrand, France",,CLERMONT-FERRAND,C,2017,SMV,Dietary oleic acid regulates hepatic lipogenesis through a liver X receptor-dependent signaling,PLOS ONE,
217505581P7,"CNRS, GReD, UMR 6293, Aubiere, France",,AUBIERE,C,2017,SMV,Dietary oleic acid regulates hepatic lipogenesis through a liver X receptor-dependent signaling,PLOS ONE,
217505581P8,"INSERM, U1103, GReD, Aubiere, France",,AUBIERE,C,2017,SMV,Dietary oleic acid regulates hepatic lipogenesis through a liver X receptor-dependent signaling,PLOS ONE,
217505581P9,"Ctr Rech Nutr Humaine Auvergne, Clermont Ferrand, France",,CLERMONT-FERRAND,NC,2017,SMV,Dietary oleic acid regulates hepatic lipogenesis through a liver X receptor-dependent signaling,PLOS ONE,
217506744P8,"Gabriel Montpied Univ Hosp, Med Intens Care Unit, Clermont Ferrand, France",,CLERMONT-FERRAND,C,2017,SMV,Initial nutritional management during noninvasive ventilation and outcomes: a retrospective cohort study,CRIT CARE,
217508007P1,"Univ Clermont Auvergne, CNRS, IRD, OPGC,Lab Magmas & Volcans, F-63100 Clermont Ferrand, France",63100,CLERMONT-FERRAND,C,2017,SMV,"Textural evolution of magma during the 9.4-ka trachytic explosive eruption at Kilian Volcano, Chaine des Puys, France",B VOLCANOL,
217508007P4,"Univ Clermont Auvergne, CNRS, IN2P3, Lab Phys Corpusculaire, Campus Univ Cezeaux,TSA 60026, F-63178 Aubiere, France",63178,AUBIERE,C,2017,SMV,"Textural evolution of magma during the 9.4-ka trachytic explosive eruption at Kilian Volcano, Chaine des Puys, France",B VOLCANOL,
217508692P5,"Clermont Univ, Univ Blaise Pascal, CNRS IN2P3, LPC, Clermont Ferrand, France",,CLERMONT-FERRAND,C,2017,SMV,Observation of the Doubly Charmed Baryon Xi(++)(cc),PHYS REV L,
217510066P1,"CHU Clermont Ferrand, CHU Estaing, Chirurg Gynecol, Clermont Ferrand, France",,CLERMONT-FERRAND,C,2017,SMV,Effects of matrix stiffness on epithelial to mesenchymal transition-like processes of endometrial epithelial cells: Implications for the pathogenesis of endometriosis,SCI REP,
217510066P2,"Univ Auvergne, Clermont Univ, ISIT UMR6284, Clermont Ferrand, France",,CLERMONT-FERRAND,C,2017,SMV,Effects of matrix stiffness on epithelial to mesenchymal transition-like processes of endometrial epithelial cells: Implications for the pathogenesis of endometriosis,SCI REP,
217510066P3,"CNRS, ISIT UMR6284, Clermont Ferrand, France",,CLERMONT-FERRAND,C,2017,SMV,Effects of matrix stiffness on epithelial to mesenchymal transition-like processes of endometrial epithelial cells: Implications for the pathogenesis of endometriosis,SCI REP,
217510066P4,"CHU Clermont Ferrand, Serv Anat & Cytol Pathol, Clermont Ferrand, France",,CLERMONT-FERRAND,C,2017,SMV,Effects of matrix stiffness on epithelial to mesenchymal transition-like processes of endometrial epithelial cells: Implications for the pathogenesis of endometriosis,SCI REP,
217510262P5,"Univ Blaise Pascal, Clermont Univ, CNRS, IN2P3,LPC, Clermont Ferrand, France",,CLERMONT-FERRAND,C,2017,SMV,Measurement of the B-+/- production asymmetry and the CP asymmetry in B-+/--> J/psi K-+/- decays,PHYS REV D,
217510458P1,"Univ Blaise Pascal, CNRS, IRD, Lab Magmas & Volcans,OPGC, Campus Univ Cezeaux,6 Ave Blaise Pascal, F-63178 Aubiere, France",63178,AUBIERE,C,2017,SMV,"First study of the heat and gas budget for Sirung volcano, Indonesia",B VOLCANOL,
217510873P82,"Univ Blaise Pascal, CNRS, LPC, Clermont Univ,IN2P3, Clermont Ferrand, France",,CLERMONT-FERRAND,C,2017,SMV,Charged-particle multiplicities in proton-proton collisions at root s=0.9 to 8 TeV,EUR PHY J C,
217511754P2,"CNRS, UMR 6024, Lab Psychol Sociale & Cognit, Clermont Ferrand, France",,CLERMONT-FERRAND,NC,2017,SHS,General and Specific Contributions of RAN to Reading and Arithmetic Fluency in First Graders: A Longitudinal Latent Variable Approach,FRONT PSYCH,
217511754P3,"Univ Auvergne, Clermont Ferrand, France",,CLERMONT-FERRAND,C,2017,SHS,General and Specific Contributions of RAN to Reading and Arithmetic Fluency in First Graders: A Longitudinal Latent Variable Approach,FRONT PSYCH,
217512289P3,"Univ Clermont Ferrand, Inst Chim Clermont Ferrand, UMR 6296, F-63171 Aubiere, France",63171,AUBIERE,C,2017,SMV,Role of Dynamical Heterogeneities on the Mechanical Response of Confined Polymer,PHYS REV L,
217513004P85,"Univ Blaise Pascal, Clermont Univ, LPC, CNRS IN2P3, Clermont Ferrand, France",,CLERMONT-FERRAND,C,2017,SMV,Measurement of electrons from beauty-hadron decays in p-Pb collisions at root(NN)-N-S=5.02 TeV and Pb-Pb collisions at. root(NN)-N-S=2.76 TeV,J HIGH EN P,
217515779P61,"Univ Clermont Auvergne, CNRS, IN2P3, LPC, Clermont Ferrand, France",,CLERMONT-FERRAND,C,2017,SMV,Measurement of inclusive and differential cross sections in the H -> ZZ* -> 4l decay channel in pp collisions at root s=13 TeV with the ATLAS detector,J HIGH EN P,
217515800P3,"Clermont Univ, Lab Microorganismes Genome & Environm, Clermont Ferrand, France",,CLERMONT-FERRAND,C,2017,SMV,"Deciphering biodiversity and interactions between bacteria and microeukaryotes within epilithic biofilms from the Loue River, France",SCI REP,
217515800P4,"CNRS, Lab Microorganismes Genome & Environm, Aubiere, France",,AUBIERE,NC,2017,SMV,"Deciphering biodiversity and interactions between bacteria and microeukaryotes within epilithic biofilms from the Loue River, France",SCI REP,
217517447P1,"Univ Clermont Auvergne, CNRS, SIGMA Clermont, Inst Chim Clermont Ferrand, F-63000 Clermont Ferrand, France",63000,CLERMONT-FERRAND,C,2017,SMV,First-Row Transition Metal Doping in Calcium Phosphate Bioceramics: A Detailed Crystallographic Study,MATERIALS,
217518814P1,"Univ Clermont Auvergne, CNRS, Lab Meteorol Phys, F-63000 Clermont Ferrand, France",63000,CLERMONT-FERRAND,C,2017,SMV,Trace Metals in Cloud Water Sampled at the Puy De Dome Station,ATMOSPHERE,
217518814P3,"Univ Clermont Auvergne, Lab Magma & Volcans, CNRS, F-63000 Clermont Ferrand, France",63000,CLERMONT-FERRAND,C,2017,SMV,Trace Metals in Cloud Water Sampled at the Puy De Dome Station,ATMOSPHERE,
217520230P61,"Univ Clermont Auvergne, CNRS, IN2P3, LPC, Clermont Ferrand, France",,CLERMONT-FERRAND,C,2017,SMV,Measurement of the k(t) splitting scales in Z -> ll events in pp collisions at root s=8TeV with the ATLAS detector,J HIGH EN P,
217520280P1,"Clermont Auvergne Univ, Inst Pascal, PHOTON N2, CNRS, 4 Ave Blaise Pascal, F-63178 Aubiere, France",63178,AUBIERE,C,2017,SMV,Photonic versus electronic quantum anomalous Hall effect,PHYS REV B,
217520380P27,"Gabriel Montpied Univ Hosp, Med ICU, Clermont Ferrand, France",,CLERMONT-FERRAND,C,2017,SMV,"The ICU-Diary study: prospective, multicenter comparative study of the impact of an ICU diary on the wellbeing of patients and families in French ICUs",TRIALS,
217520380P28,"Univ Clermont Ferrand, CNRS, LMGE, UMR 6023, Clermont Ferrand, France",,CLERMONT-FERRAND,C,2017,SMV,"The ICU-Diary study: prospective, multicenter comparative study of the impact of an ICU diary on the wellbeing of patients and families in French ICUs",TRIALS,
217520431P16,"Univ Blaise Pascal, Clermont Univ, CNRS IN2P3, Lab Phys Corpusculaire, BP 10448, F-63000 Clermont Ferrand, France",63000,CLERMONT-FERRAND,C,2017,SMV,Stacked search for time shifted high energy neutrinos from gamma ray bursts with the ANTARES neutrino telescope,EUR PHY J C,
217520498P10,"Univ Clermont Auvergne, CHU Clermont Ferrand, INRA, Serv Med Phys & Readaptat, F-63000 Clermont Ferrand, France",63000,CLERMONT-FERRAND,C,2017,SMV,Intensive spa and exercise therapy program for returning to work for low back pain patients: a randomized controlled trial,SCI REP,
217520801P2,"Univ Blaise Pascal, Univ Clermont Auvergne, UMR CNRS 6296, ICCF, BP 10448, F-63000 Clermont Ferrand, France",63000,CLERMONT-FERRAND,C,2017,SMV,Test-area surface tension calculation of the graphene-methane interface: Fluctuations and commensurability,J CHEM PHYS,
217521589P5,"Univ Blaise Pascal, Clermont Univ, CNRS, IN2P3,LPC, Clermont Ferrand, France",,CLERMONT-FERRAND,C,2017,SMV,First Experimental Study of Photon Polarization in Radiative B-s(0) Decays,PHYS REV L,
217522257P1,"Ctr Jean Perrin CBRV, Dept Oncogenet, 28 Pl Henri Dunant,BP 38, F-63001 Clermont Ferrand, France",63001,CLERMONT-FERRAND,C,2017,SMV,Global analysis of H3K27me3 as an epigenetic marker in prostate cancer progression,BMC CANCER,
217522257P2,"IMOST, INSERM U 1240, 58 Rue Montalembert,BP 184, F-63005 Clermont Ferrand, France",63005,CLERMONT-FERRAND,NC,2017,SMV,Global analysis of H3K27me3 as an epigenetic marker in prostate cancer progression,BMC CANCER,
217522257P3,"Univ Blaise Pascal, Inst Pascal CNRS UBP UMR 6602, 24 Ave Landais, Aubiere, France",,AUBIERE,C,2017,SMV,Global analysis of H3K27me3 as an epigenetic marker in prostate cancer progression,BMC CANCER,
217522257P4,"Gabriel Montpied Hosp, Dept Biopathol, 58 Rue Montalembert, F-63000 Clermont Ferrand, France",63000,CLERMONT-FERRAND,C,2017,SMV,Global analysis of H3K27me3 as an epigenetic marker in prostate cancer progression,BMC CANCER,
217522257P5,"Ctr Jean Perrin, Dept Biopathol, 58 Rue Montalembert, F-63000 Clermont Ferrand, France",63000,CLERMONT-FERRAND,C,2017,SMV,Global analysis of H3K27me3 as an epigenetic marker in prostate cancer progression,BMC CANCER,
217522257P6,"Gabriel Montpied Hosp, Dept Urol, 58 Rue Montalembert, F-63000 Clermont Ferrand, France",63000,CLERMONT-FERRAND,C,2017,SMV,Global analysis of H3K27me3 as an epigenetic marker in prostate cancer progression,BMC CANCER,
217523476P5,"Equipe ECREIN UNH, INRA, UMR 1019, Clermont Ferrand, France",,CLERMONT-FERRAND,C,2017,SMV,Strength Training Decreases Inflammation and Increases Cognition and Physical Fitness in Older Women with Cognitive Impairment,FRON PHYSIO,
217523527P62,"Univ Clermont Auvergne, CNRS, IN2P3, LPC, Clermont Ferrand, France",,CLERMONT-FERRAND,C,2017,SMV,Search for new phenomena with large jet multiplicities and missing transverse momentum using large-radius jets and flavour-tagging at ATLAS in 13 TeV pp collisions,J HIGH EN P,
217523683P90,"Univ Clermont Ferrand 2, Univ Blaise Pascal, Phys Corpusculaire Lab, CNRS,IN2P3, Clermont Ferrand, France",,CLERMONT-FERRAND,C,2017,SMV,W and Z boson production in p-Pb collisions at TeV root s(NN)=5.02 TeV,J HIGH EN P,
217524940P1,"INRA, CRNH Auvergne, UMR 1019, UNH, F-63000 Clermont Ferrand, France",63000,CLERMONT-FERRAND,C,2017,SMV,Addressing the inter-individual variation in response to consumption of plant food bioactives: Towards a better understanding of their role in healthy aging and cardiometabolic risk reduction,MOL NUTR FO,
217524940P2,"Univ Auvergne, Clermont Univ, Unite Nutr Humaine, BP 10448, F-63000 Clermont Ferrand, France",63000,CLERMONT-FERRAND,C,2017,SMV,Addressing the inter-individual variation in response to consumption of plant food bioactives: Towards a better understanding of their role in healthy aging and cardiometabolic risk reduction,MOL NUTR FO,
217525123P10,"INRA, Plateforme Gentyane, UMR Genet Divers & Ecophysiol Cereals 1095, Clermont Ferrand, France",,CLERMONT-FERRAND,NC,2017,SMV,Genome-Wide Association Mapping of Flowering and Ripening Periods in Apple,FRONT PLA S,
217527441P1,"Univ Clermont Auvergne, Lab Phys Clermont Particules pLasmas Universe app, CNRS, IN2P3, F-63000 Clermont Ferrand, France",63000,CLERMONT-FERRAND,C,2017,SMV,Sampling Rate and ADC Resolution Requirements in Digital Front-End Electronics for TOF PET,IEEE NUCL S,10.1109/TNS.2017.2732038
217529928P5,"Univ J Monnet, CNRS, UMR6524, Lab Magmas & Volcans, 23 Rue Dr P Michelon, F-42023 St Etienne, France",42023,SAINT-ETIENNE,C,2017,SMV,Incommensurately modulated twin structure of nyerereite Na1.64K0.36Ca(CO3)(2),ACT CRYST B,10.1107/S2052520616020680
217530216P3,"FERDI, 63 Blvd Francois Mitterrand, F-63000 Clermont Ferrand, France",63000,CLERMONT-FERRAND,NC,2017,SHS,Natural Disasters and Poverty Reduction: Do Remittances Matter?,CESIFO ECON,10.1093/cesifo/ifx016
217530837P3,"Univ Teaching Hosp Clermont Ferrand, Estaing Hosp, Dept Anesthesiol & Crit Care Med, Clermont Ferrand, France",,CLERMONT-FERRAND,C,2017,SMV,Positive end-expiratory pressure does not decrease cardiac output during laparoscopic liver surgery A prospective observational evaluation,HPB,10.1016/j.hpb.2016.10.009
217532143P1,"Univ Clermont Auvergne, SIGMA, UMR CNRS 6602, Inst Pascal, Clermont Ferrand, France",,CLERMONT-FERRAND,C,2017,SMV,An Approach for Modelling Harvester Head Mechanism in the Harvesting Process of Hardwood Stands,MECH MACH,10.1007/978-3-319-45450-4_14
217532871P26,"Hop Hotel Dieu, Serv Hepatol, Clermont Ferrand, France",,CLERMONT-FERRAND,NC,2017,SMV,Eradication of Hepatitis C Virus Infection in Patients With Cirrhosis Reduces Risk of Liver and Non-Liver Complications,GASTROENTY,10.1053/j.gastro.2016.09.009
217534021P6,"Ctr Hosp Univ Estaing, Serv Chirurg Digest, 1 Pl Lucie Aubrac, F-63003 Clermont Ferrand, France",63003,CLERMONT-FERRAND,C,2017,SMV,Are enhanced recovery programs in colorectal surgery feasible and useful in the elderly? A systematic review of the literature,J VISC SURG,10.1016/j.jviscsurg.2016.09.016
217536532P1,"Univ Blaise Pascal, Univ Clermont Auvergne, Inst Chim Clermont Ferrand, BP 10448, F-63000 Clermont Ferrand, France",63000,CLERMONT-FERRAND,C,2017,SMV,PROTON EXCHANGE MEMBRANE FUEL CELL WITH ENHANCED DURABILITY USING FLUORINATED CARBON AS ELECTROCATALYST,E3S WEB C,10.1051/e3sconf/20171617001
217536532P2,"CNRS, UMR 6296, ICCF, F-63171 Aubiere, France",63171,AUBIERE,C,2017,SMV,PROTON EXCHANGE MEMBRANE FUEL CELL WITH ENHANCED DURABILITY USING FLUORINATED CARBON AS ELECTROCATALYST,E3S WEB C,10.1051/e3sconf/20171617001
217536708P1,"INRA, Unite Rech Fromageres, F-15000 Aurillac, France",15000,AURILLAC,NC,2017,SMV,"Molecular characterization of O157:H7, O26:H11 and O103:H2 Shiga toxin-producing Escherichia coli isolated from dairy products",INT J F MIC,10.1016/j.ijfoodmicro.2017.04.010
217537645P8,"Clermont Univ, UMR CNRS 6293, INSERM U1103, Clermont Ferrand, France",,CLERMONT-FERRAND,C,2017,SMV,The siRNA suppressor RTL1 is redox-regulated through glutathionylation of a conserved cysteine in the double-stranded-RNA-binding domain,NUCL ACID R,10.1093/nar/gkx820
217537885P1,"Univ Clermont Auvergne, CNRS, Lab Magmas & Volcans, IRD, Campus Univ Cezeaux, Aubiere, France",,AUBIERE,C,2017,SMV,"Magma storage beneath Grimsvotn volcano, Iceland, constrained by clinopyroxene-melt thermobarometry and volatiles in melt inclusions and groundmass glass",J GEO R-SOL,10.1002/2017JB014067
217538619P2,"INRA, UMR Metaft 1273, F-63122 St Genes Champanelle, France",63122,SAINT-GENES-CHAMPANELLE,NC,2017,SMV,"Interactions between intervention packages, climatic risk, climate change and food security in mixed crop-livestock systems in Burkina Faso",AGR SYST,10.1016/j.agsy.2015.12.017
217539321P1,"Comprehens Anticanc Ctr Jean Perrin, Dept Clin Res, 58 Rue Montalembert, F-63011 Clermont Ferrand, France",63011,CLERMONT-FERRAND,C,2017,SMV,Long-term improvement of breast cancer survivors' quality of life by a 2-week group physical and educational intervention: 5-year update of the 'PACThe' trial,BR J CANC,10.1038/bjc.2017.112
217539321P2,"Comprehens Anticanc Ctr Jean Perrin, Dept Oncol, 58 Rue Montalembert, F-63011 Clermont Ferrand, France",63011,CLERMONT-FERRAND,C,2017,SMV,Long-term improvement of breast cancer survivors' quality of life by a 2-week group physical and educational intervention: 5-year update of the 'PACThe' trial,BR J CANC,10.1038/bjc.2017.112
217539321P3,"Gabriel Montpied Univ Hosp, Dept Sport Med & Funct Explorat, Pl Henri Dunant, F-63000 Clermont Ferrand, France",63000,CLERMONT-FERRAND,C,2017,SMV,Long-term improvement of breast cancer survivors' quality of life by a 2-week group physical and educational intervention: 5-year update of the 'PACThe' trial,BR J CANC,10.1038/bjc.2017.112
217539321P7,"Comprehens Anticanc Ctr Jean Perrin, Dept Nutr, 58 Rue Montalembert, F-63011 Clermont Ferrand, France",63011,CLERMONT-FERRAND,C,2017,SMV,Long-term improvement of breast cancer survivors' quality of life by a 2-week group physical and educational intervention: 5-year update of the 'PACThe' trial,BR J CANC,10.1038/bjc.2017.112
217539321P9,"Comprehens Anticanc Ctr Jean Perrin, Dept Oncogenet, 58 Rue Montalembert, F-63011 Clermont Ferrand, France",63011,CLERMONT-FERRAND,C,2017,SMV,Long-term improvement of breast cancer survivors' quality of life by a 2-week group physical and educational intervention: 5-year update of the 'PACThe' trial,BR J CANC,10.1038/bjc.2017.112
217540664P1,"Clermont Univ, UBP CNRS IRD, Lab Magmas & Volcans, 6 Ave Blaise Pascal, F-63178 Aubiere, France",63178,AUBIERE,C,2017,SMV,"Age, provenance and Precambrian evolution of the Anabar shield from U-Pb and Lu-Hf isotope data on detrital zircons, and the history of the northern and central Siberian craton",PRECAMB RES,10.1016/j.precamres.2017.09.008
217541455P1,"Univ Blaise Pascal, Ctr Rech Philosophies & Rational, Clermont Ferrand, France",,CLERMONT-FERRAND,C,2017,SHS,Seated meditation: thinking without thinking. A spiritual exercise in Dogen's Zen,REV PHIL FR,10.3917/rphi.171.0015
217543565P4,"CHU Clermont Ferrand, Dept Digest & Hepatobiliary Surg, Clermont Ferrand, France",,CLERMONT-FERRAND,C,2017,SMV,Multicentric initial experience with the use of the pressurized intraperitoneal aerosol chemotherapy (PIPAC) in the management of unresectable peritoneal carcinomatosis,EJSO,10.1016/j.ejso.2017.09.010
217543565P8,"Univ Clermont Auvergne, INSERM U1071, Clermont Ferrand, France",,CLERMONT-FERRAND,C,2017,SMV,Multicentric initial experience with the use of the pressurized intraperitoneal aerosol chemotherapy (PIPAC) in the management of unresectable peritoneal carcinomatosis,EJSO,10.1016/j.ejso.2017.09.010
217545357P2,"Univ Blaise Pascal, CNRS, IRD, Lab Magmas & Volcans, Campus Univ Cezeaux,6 Ave Blaise Pascal, F-63178 Aubiere, France",63178,AUBIERE,C,2017,SMV,"Antisana volcano: A representative andesitic volcano of the eastern cordillera of Ecuador: Petrography, chemistry, tephra and glacial stratigraphy",J S AM EART,10.1016/j.jsames.2016.11.005
217545581P1,"Univ Blaise Pascal, Lab Magmas & Volcans, UMR 6524, CNRS, Campus Univ Cezeaux,6 Ave Blaise Pascal, F-63178 Aubiere, France",63178,AUBIERE,C,2017,SMV,"Nitrile, Latex, Neoprene and Vinyl Gloves: A Primary Source of Contamination for Trace Element and Zn Isotopic Analyses in Geological and Biological Samples",GEOSTAND GE,10.1111/ggr.12161
217546743P2,"Univ Clermont Auvergne, INRA, UMRF, F-15000 Aurillac, France",15000,AURILLAC,C,2017,SMV,Contribution of fluorescence spectroscopy and independent components analysis to the evaluation of NaCl and KCl effects on molecular-structure and fat melting temperatures of Cantal-type cheese,INT DAIRY J,10.1016/j.idairyj.2017.05.004
217547232P1,"Hop Hotel Dieu, CHU Clermont Ferrand, Serv Odontol, F-63001 Clermont Ferrand, France",63001,CLERMONT-FERRAND,C,2017,SMV,"Knowledge, opinions and practices of French general practitioners in the assessment of caries risk: results of a national survey",CLIN ORAL I,10.1007/s00784-016-1932-y
217547232P2,"Univ Clermont1, UFR Odontol, F-63000 Clermont Ferrand, France",63000,CLERMONT-FERRAND,C,2017,SMV,"Knowledge, opinions and practices of French general practitioners in the assessment of caries risk: results of a national survey",CLIN ORAL I,10.1007/s00784-016-1932-y
217547232P3,"Ctr Rech Odontol Clin EA 4847, F-63000 Clermont Ferrand, France",63000,CLERMONT-FERRAND,NC,2017,SMV,"Knowledge, opinions and practices of French general practitioners in the assessment of caries risk: results of a national survey",CLIN ORAL I,10.1007/s00784-016-1932-y
217547232P4,"Univ Blaise Pascal, Dept Math, F-63177 Aubiere, France",63177,AUBIERE,C,2017,SMV,"Knowledge, opinions and practices of French general practitioners in the assessment of caries risk: results of a national survey",CLIN ORAL I,10.1007/s00784-016-1932-y
217548657P1,"CNRS, OPGC, UBP UMR6524, 4 Ave Blaise Pascal, F-63178 Aubiere, France",63178,AUBIERE,NC,2017,SMV,"Very-low-frequency resistivity, self-potential and ground temperature surveys on Taal volcano (Philippines): Implications for future activity",J VOLCANOL,10.1016/j.volgeores.2017.04.020
217550293P1,"Univ Blaise Pascal, LMV, Aubiere, France",,AUBIERE,C,2017,SMV,"Cloudburst, weather bomb or water bomb? A review of terminology for extreme rain events and the media effect",WEATHER,10.1002/wea.2923
217551709P4,"INRA, Genet Divers & Ecophysiol Cereals GDEC UMR1095, Clermont Ferrand, France",,CLERMONT-FERRAND,C,2017,SMV,Wheat glutenin: the 'tail' of the 1By protein subunits,J PROTEOMIC,10.1016/j.jprot.2017.05.019
217552102P96,"Clermont Univ, Univ Blaise Pascal, CNRS, IN2P3,LPC, Clermont Ferrand, France",,CLERMONT-FERRAND,C,2017,SMV,Linear and non-linear flow mode in Pb-Pb collisions at root sNN=2.76 TeV,PHYS LETT B,10.1016/j.physletb.2017.07.060
217553615P3,"Univ Clermont Auvergne, CNRS, Sigma Clermont, ICCF, F-63000 Clermont Ferrand, France",63000,CLERMONT-FERRAND,C,2017,SMV,Synthesis of novel profluorescent nitroxides as dual luminescent-paramagnetic active probes,NEW J CHEM,10.1039/c7nj01698k
217554083P5,"Univ Blaise Pascal, CNRS, UMR 6016, Lab Meteorol Phys LaMP, F-63171 Aubiere, France",63171,AUBIERE,C,2017,SMV,Quantitative cancer risk assessment and local mortality burden for ambient air pollution in an eastern Mediterranean City,ENV SCI P R,10.1007/s11356-017-9000-y
217554199P1,"Univ Clermont 1, CHU Estaing, ERTICa, Dept Med Cytogenet,EA 4677, Clermont Ferrand, France",,CLERMONT-FERRAND,C,2017,SMV,"Characterization by microarray and meiotic segregation study of a der(10)t(10,18) in a patient with infertility and normal phenotype",ASIAN J AND,10.4103/1008-682X.172818
217555773P1,"Univ Clermont Auvergne, Inst Pascal, SIGMA Clermont, BP 10448, F-63000 Clermont Ferrand, France",63000,CLERMONT-FERRAND,C,2017,SMV,Dynamic modeling and stability prediction in robotic machining,INT J ADV M,10.1007/s00170-016-8938-0
