adrCleost,adresse,codePostal,ville,Statut,anneePubli,Domaine,Titre Article,Titre Journal,doi
219164564P1,"CHU Clermont Ferrand, Pole Gynecol Obstet, 1 Pl L&R, F-63003 Clermont Ferrand 1, France",630031,CLERMONT-FERRAND,C,2017,SMV,"Congenital unilateral renal agenesis: Prevalence, prenatal diagnosis, associated anomalies. Data from two birth-defect registries",BIRTH DEF R,10.1002/bdr2.1065
219164564P2,"UCA, CNRS, Inst Pascal, TGI PEPRADE, Clermont Ferrand, France",,CLERMONT-FERRAND,C,2017,SMV,"Congenital unilateral renal agenesis: Prevalence, prenatal diagnosis, associated anomalies. Data from two birth-defect registries",BIRTH DEF R,10.1002/bdr2.1065
219164564P7,"CHU Clermont Ferrand, Serv Genet Med, Clermont Ferrand, France",,CLERMONT-FERRAND,C,2017,SMV,"Congenital unilateral renal agenesis: Prevalence, prenatal diagnosis, associated anomalies. Data from two birth-defect registries",BIRTH DEF R,10.1002/bdr2.1065
219164564P8,"CHU Clermont Ferrand, Pole Sante Publ, Clermont Ferrand, France",,CLERMONT-FERRAND,C,2017,SMV,"Congenital unilateral renal agenesis: Prevalence, prenatal diagnosis, associated anomalies. Data from two birth-defect registries",BIRTH DEF R,10.1002/bdr2.1065
219167270P4,"Univ Blaise Pascal Clermont Ferrand II, CNRS, UMR 6620, Lab Math, Campus Univ Cezeaux, F-63177 Aubiere, France",63177,AUBIERE,C,2017,SMV,Modular generalized Springer correspondence III: exceptional groups,MATH ANNAL,10.1007/s00208-017-1524-4
219167844P1,"Univ Blaise Pascal, CNRS, Lab Meteorol Phys, Aubiere, France",,AUBIERE,C,2017,SMV,Ice Crystal Sizes in High Ice Water Content Clouds. Part II: Statistics of Mass Diameter Percentiles in Tropical Convection Observed during the HAIC/HIWC Project,J ATMOSP OC,10.1175/JTECH-D-15-0246.1
219168190P1,"Clermont Univ, VetAgroSup, Herbivores UMR1213, BP 10448, F-63000 Clermont Ferrand, France",63000,CLERMONT-FERRAND,C,2017,SMV,"Co-construction of an assessment method of the environmental sustainability for cattle farms involved in a Protected Designation of Origin (PDO) cheese value chain, Cantal PDO",ECOL INDIC,10.1016/j.ecolind.2017.01.035
219170598P2,"Univ Clermont Auvergne, CNRS, Sigma Clermont, Inst Pascal UMR 6602, F-63177 Aubiere, France",63177,AUBIERE,C,2017,SMV,Brunovsky's Linear Form of Incremental Structure From Motion,IEEE T ROBO,10.1109/TRO.2017.2715344
219170625P5,"Univ Limoges, Univ Blaise Pascal, GEOLAB CNRS, UMR 6042, 4 Rue Ledru, F-63057 Clermont Ferrand 1, France",630571,CLERMONT-FERRAND,C,2017,SMV,Spatiotemporal heterogeneity of larch budmoth outbreaks in the French Alps over the last 500 years,CAN J FORES,10.1139/cjfr-2016-0211
219170772P26,"CHU Clermont Ferrand, Clermont Ferrand, France",,CLERMONT-FERRAND,C,2017,SMV,Impact of Expert Pathologic Review of Lymphoma Diagnosis: Study of Patients From the French Lymphopath Network,J CL ONCOL,10.1200/JCO.2016.71.2083
219172104P5,"Clermont Ferrand Univ, Fac Med, Dept Gen Practice, 28 Pl Henri Dunant, F-63000 Clermont Ferrand, France",63000,CLERMONT-FERRAND,C,2017,SMV,Efficacy and safety of DPP-4 inhibitors in patients with type 2 diabetes: Meta-analysis of placebo-controlled randomized clinical trials,DIABETE MET,10.1016/j.diabet.2016.09.005
219172104P8,"Clermont Ferrand Univ Hosp, Investigat Ctr, INSERM, CIC 1401, 58 Rue Montalembert, F-63000 Clermont Ferrand, France",63000,CLERMONT-FERRAND,C,2017,SMV,Efficacy and safety of DPP-4 inhibitors in patients with type 2 diabetes: Meta-analysis of placebo-controlled randomized clinical trials,DIABETE MET,10.1016/j.diabet.2016.09.005
219172711P5,"Univ Blaise Pascal, Polytech Clermont Ferrand, Clermont Ferrand, France",,CLERMONT-FERRAND,C,2017,SMV,Structural determinants of APOBEC3B non-catalytic domain for molecular assembly and catalytic regulation,NUCL ACID R,10.1093/nar/gkx362
219173855P1,"Univ Clermont Auvergne, LIMOS, CNRS, Aubiere, France",,AUBIERE,C,2017,SMV,Counting Minimal Dominating Sets,LECT N COMP,10.1007/978-3-319-55911-7_24
219174295P84,"Univ Blaise Pascal, Clermont Univ, LPC, CNRS,IN2P3, Clermont Ferrand, France",,CLERMONT-FERRAND,C,2017,SMV,Production of muons from heavy-flavour hadron decays in p-Pb collisions at root s(NN)=5.02 TeV,PHYS LETT B,10.1016/j.physletb.2017.03.049
219174882P1,"Univ Clermont Auvergne, CNRS, SIGMA Clermont, Inst Chim Clermont Ferrand, F-63000 Clermont Ferrand, France",63000,CLERMONT-FERRAND,C,2017,SMV,Disinfection of water inoculated with Enterococcus faecalis using solar/Fe(III)EDDS-H2O2 or S2O82- process,WATER RES,10.1016/j.watres.2017.03.061
219176281P15,"Ctr Jean Perrin, Clermont Ferrand, France",,CLERMONT-FERRAND,C,2017,SMV,Prospective evaluation of serum anti-Mullerian hormone dynamics in 250 women of reproductive age treated with chemotherapy for breast cancer,EUR J CANC,10.1016/j.ejca.2017.03.035
219176409P1,"CHU Clermont Ferrand, Serv Hematol Biol, Clermont Ferrand, France",,CLERMONT-FERRAND,C,2017,SMV,Plasma hypercoagulability in the presence of thrombomodulin but not of activated protein C in patients with cirrhosis,J GASTR HEP,10.1111/jgh.13493
219176409P3,"CHU Clermont Ferrand, Serv Hepatogastroenterol, Clermont Ferrand, France",,CLERMONT-FERRAND,C,2017,SMV,Plasma hypercoagulability in the presence of thrombomodulin but not of activated protein C in patients with cirrhosis,J GASTR HEP,10.1111/jgh.13493
219176409P4,"INRA Univ Auvergne, UMR1019, Unite Nutr Humaine, Clermont Ferrand, France",,CLERMONT-FERRAND,C,2017,SMV,Plasma hypercoagulability in the presence of thrombomodulin but not of activated protein C in patients with cirrhosis,J GASTR HEP,10.1111/jgh.13493
219176409P5,"Univ Auvergne, CNRS, UMR 6284, Clermont Ferrand, France",,CLERMONT-FERRAND,C,2017,SMV,Plasma hypercoagulability in the presence of thrombomodulin but not of activated protein C in patients with cirrhosis,J GASTR HEP,10.1111/jgh.13493
219176968P5,"Univ Blaise Pascal, CNRS, Lab Magmas & Volcans, Clermont Ferrand, France",,CLERMONT-FERRAND,C,2017,SMV,SIMS chlorine isotope analyses in melt inclusions from arc settings,CHEM GEOL,10.1016/j.chemgeo.2016.12.002
219177240P4,"Univ Blaise Pascal, Clermont Univ, Inst Chim Clermont Ferrand ICCF ENSCCF, BP 10448, F-63000 Clermont Ferrand, France",63000,CLERMONT-FERRAND,C,2017,SMV,Algae decorated TiO2/Ag hybrid nanofiber membrane with enhanced photocatalytic activity for Cr(VI) removal under visible light,CHEM ENGN J,10.1016/j.cej.2016.12.020
219177240P5,"Inst Chim Clermont Ferrand, CNRS, UMR 6296, F-63171 Aubiere, France",63171,AUBIERE,C,2017,SMV,Algae decorated TiO2/Ag hybrid nanofiber membrane with enhanced photocatalytic activity for Cr(VI) removal under visible light,CHEM ENGN J,10.1016/j.cej.2016.12.020
219180183P3,"Clermont Univ, CNRS UBP SIGMA Clermont, UMR 6296, Inst Chim Clermont Ferrand, 24 Ave Landais,BP 80026, F-63171 Aubiere, France",63171,AUBIERE,C,2017,SMV,Development of flame retardant cotton fabric based on ionic liquids via sol-gel technique,IOP CONF S,10.1088/1757-899X/254/12/122001
219181059P1,"CHU Clermont Ferrand, Hop Gabriel Montpied, Serv Med Interne, 58 Rue Montalembert, F-63003 Clermont Ferrand, France",63003,CLERMONT-FERRAND,C,2017,SMV,Craniofacial fibrous dysplasia: A 10-case series,EUR ANN OTO,10.1016/j.anorl.2017.02.004
219181059P2,"Univ Clermont Auvergne, CHU Clermont Ferrand, Serv Med Interne, Hop Gabriel Montpied,Inserm U1071,INRA USC2018,M2, F-63003 Clermont Ferrand, France",63003,CLERMONT-FERRAND,C,2017,SMV,Craniofacial fibrous dysplasia: A 10-case series,EUR ANN OTO,10.1016/j.anorl.2017.02.004
219181059P3,"Univ Clermont Auvergne, CHU Clermont Ferrand, Serv ORL, Hop Gabriel Montpied,UMR Inserm Equipe Biophys Ne, F-63003 Clermont Ferrand, France",63003,CLERMONT-FERRAND,C,2017,SMV,Craniofacial fibrous dysplasia: A 10-case series,EUR ANN OTO,10.1016/j.anorl.2017.02.004
219181059P4,"CHU Clermont Ferrand, Serv Radiol, Hop Gabriel Montpied, 58 Rue Montalembert, F-63003 Clermont Ferrand, France",63003,CLERMONT-FERRAND,C,2017,SMV,Craniofacial fibrous dysplasia: A 10-case series,EUR ANN OTO,10.1016/j.anorl.2017.02.004
219181657P3,"Univ Blaise Pascal, Univ Clermont Auvergne, Inst Pascal, BP 20206, F-63000 Clermont Ferrand, France",63000,CLERMONT-FERRAND,C,2017,SMV,Probabilistic Improvement of Crack Propagation Monitoring by Using Acoustic Emission,C PROC SEM,10.1007/978-3-319-42195-7_16
219181657P4,"CNRS, UMR 6602, Inst Pascal, Aubiere, France",,AUBIERE,C,2017,SMV,Probabilistic Improvement of Crack Propagation Monitoring by Using Acoustic Emission,C PROC SEM,10.1007/978-3-319-42195-7_16
219182426P1,"INRA, UBP, UMR 1095, GDEC, 5 Chemin Beaulieu, F-63100 Clermont Ferrand, France",63100,CLERMONT-FERRAND,C,2017,SMV,Reconciling the evolutionary origin of bread wheat (Triticum aestivum),NEW PHYTOL,10.1111/nph.14113
219184001P17,"Univ Hosp, Clermont Ferrand, France",,CLERMONT-FERRAND,C,2017,SMV,Prospective Evaluation of Magnetic Resonance Imaging and [F-18]Fluorodeoxyglucose Positron Emission Tomography-Computed Tomography at Diagnosis and Before Maintenance Therapy in Symptomatic Patients With Multiple Myeloma Included in the IFM/DFCI 2009 Trial: Results of the IMAJEM Study,J CL ONCOL,10.1200/JCO.2017.72.2975
219185857P5,"CHU Clermont Ferrand, Estaing Hosp, Clermont Ferrand, France",,CLERMONT-FERRAND,C,2017,SMV,Ibrutinib in very elderly patients with relapsed/refractory chronic lymphocytic leukemia: A real-world experience of 71 patients treated in France: A study from the French Innovative Leukemia Organization (FILO) group,AM J HEMAT,10.1002/ajh.24715
219188417P1,"CHU Gabriel Montpied, Clermont Ferrand Univ Hosp, Dept Ophthalmol, RMND Pole M2O, 58 Rue Montalembert, F-63000 Clermont Ferrand, France",63000,CLERMONT-FERRAND,C,2017,SMV,A form of central areolar choroidal dystrophy,J FR OPHTAL,10.1016/j.jfo.2016.01.019
219188417P3,"Auvergne Univ, Fac Med, Biochem Lab, EA 7281 R2D2, F-63000 Clermont Ferrand, France",63000,CLERMONT-FERRAND,C,2017,SMV,A form of central areolar choroidal dystrophy,J FR OPHTAL,10.1016/j.jfo.2016.01.019
219188527P1,"Clermont Auvergne Univ, Inst Pascal, UCA SIGMA, UMR 6602,CNRS, Clermont Ferrand, France",,CLERMONT-FERRAND,C,2017,SMV,Reactive versus cognitive vehicle navigation based on optimal local and global PELC,ROBOT AUT S,10.1016/j.robot.2016.11.006
219188901P1,"Estaing Univ Hosp, Dept Digest & Hepatobiliary Dis, Clermont Ferrand, France",,CLERMONT-FERRAND,C,2017,SMV,Long-term outcome of endoscopic ultrasound-guided pelvic abscess drainage: a two-center series,ENDOSCOPY,10.1055/s-0042-122011
219188901P2,"UMR Auvergne Univ, CNRS ISIT Image Sci Innovat Tech 6284, Clermont Ferrand, France",,CLERMONT-FERRAND,C,2017,SMV,Long-term outcome of endoscopic ultrasound-guided pelvic abscess drainage: a two-center series,ENDOSCOPY,10.1055/s-0042-122011
219188901P4,"Gabriel Montpied Univ Hosp, Biostat Unit, DRCI, F-63003 Clermont Ferrand, France",63003,CLERMONT-FERRAND,C,2017,SMV,Long-term outcome of endoscopic ultrasound-guided pelvic abscess drainage: a two-center series,ENDOSCOPY,10.1055/s-0042-122011
219188901P5,"Estaing Univ Hosp, Clin Res Unit, Clermont Ferrand, France",,CLERMONT-FERRAND,C,2017,SMV,Long-term outcome of endoscopic ultrasound-guided pelvic abscess drainage: a two-center series,ENDOSCOPY,10.1055/s-0042-122011
219190139P3,"Univ Clermont Auvergne, Lab Magmas & Volcans, CNRS, IRD,OPGC, 6 Ave Blaise Pascal, F-63178 Clermont Ferrand, France",63178,CLERMONT-FERRAND,C,2017,SMV,"The initiation and development of a caldera-forming Plinian eruption (172 ka Lower Pumice 2 eruption, Santorini, Greece)",J VOLCANOL,10.1016/j.jvolgeores.2017.05.034
219191932P6,"LAMP, Campus Univ Cezeaux,4 Ave Blaise Pascal, F-63178 Aubiere, France",63178,AUBIERE,C,2017,SMV,Summertime OH reactivity from a receptor coastal site in the Mediterranean Basin,ATMOS CH PH,10.5194/acp-17-12645-2017
219193698P19,"Univ Clermont Ferrand, Dept Dermatol, Clermont Ferrand, France",,CLERMONT-FERRAND,C,2017,SMV,"First-line rituximab combined with short-term prednisone versus prednisone alone for the treatment of pemphigus (Ritux 3): a prospective, multicentre, parallel-group, open-label randomised trial",LANCET,10.1016/S0140-6736(17)30070-3
219196844P3,"INRA, UR 454 Microbiol, F-63122 St Genes Champanelle, France",63122,SAINT-GENES-CHAMPANELLE,NC,2017,SMV,"Collagen type I from bovine bone. Effect of animal age, bone anatomy and drying methodology on extraction yield, self-assembly, thermal behaviour and electrokinetic potential",INT J BIO M,10.1016/j.ijbiomac.2016.12.068
219199113P1,"Univ Blaise Pascal, Clermont Univ, Inst Pascal, 2 Ave Blaise Pascal,TSA 60206,CS 60026, F-63178 Aubiere, France",63178,AUBIERE,C,2017,SMV,Harvesting of microalgae Chlorella vulgaris using electro-coagulation-flocculation in the batch mode,ALGAL RES,10.1016/j.algal.2017.03.015
219199113P2,"CNRS, UMR 6602, IP, F-63171 Aubiere, France",63171,AUBIERE,NC,2017,SMV,Harvesting of microalgae Chlorella vulgaris using electro-coagulation-flocculation in the batch mode,ALGAL RES,10.1016/j.algal.2017.03.015
219201917P5,"CHU Clermont Ferrand, Serv Odontol, F-63001 Clermont Ferrand, France",63001,CLERMONT-FERRAND,C,2017,SMV,Dentists' attitudes and behaviour regarding deep carious lesion management: a multi-national survey,CLIN ORAL I,10.1007/s00784-016-1776-5
219201917P6,"Univ Clermont1, UFR Odontol, Ctr Rech Odontol Clin EA 4847, F-63100 Clermont Ferrand, France",63100,CLERMONT-FERRAND,C,2017,SMV,Dentists' attitudes and behaviour regarding deep carious lesion management: a multi-national survey,CLIN ORAL I,10.1007/s00784-016-1776-5
219201917P7,"2 Rue Braga, F-63100 Clermont Ferrand, France",63100,CLERMONT-FERRAND,NC,2017,SMV,Dentists' attitudes and behaviour regarding deep carious lesion management: a multi-national survey,CLIN ORAL I,10.1007/s00784-016-1776-5
219202499P2,"Univ Blaise Pascal, Univ Clermont Auvergne, Inst Chim Clermont Ferrand, BP 10448, F-63000 Clermont Ferrand, France",63000,CLERMONT-FERRAND,C,2017,SMV,Nanocomposite latexes containing layered double hydroxides via RAFT-assisted encapsulating emulsion polymerization,POLYM CHEM,10.1039/c6py01742h
219202499P3,"CNRS, ICCF, UMR 6296, F-63171 Aubiere, France",63171,AUBIERE,C,2017,SMV,Nanocomposite latexes containing layered double hydroxides via RAFT-assisted encapsulating emulsion polymerization,POLYM CHEM,10.1039/c6py01742h
219203492P3,"Univ Clermont Auvergne, CNRS, IRD, Lab Magmas & Volcans,UMR 6524, 6 Ave Blaise Pascal, F-63178 Aubiere, France",63178,AUBIERE,C,2017,SMV,New constraints on the early formation of the Western Dharwar Craton (India) from igneous zircon U-Pb and Lu-Hf isotopes,PRECAMB RES,10.1016/j.precamres.2017.09.016
219204072P3,"UMR CNRS 6042, GEOLAB, Limoges, France",,LIMOGES,C,2017,SMV,A long-term tree-ring chronology over 796 years for silver fir (Abies alba Mill.) in Southern France,ANN FOR SCI,10.1007/s13595-017-0664-8
219204095P3,"Univ Blaise Pascal, CNRS, LIMOS, UMR 6158,Bat ISIMA, Campus Cezeaux,BP 125, F-63173 Aubiere, France",63173,AUBIERE,C,2017,SMV,Knapsack problem with objective value gaps,OPTIM LETT,10.1007/s11590-016-1043-3
219204131P1,"Univ Clermont Ferrand, CNRS UMR6293, INSERM U1103, Ladybird Team GReD, F-63000 Clermont Ferrand, France",63000,CLERMONT-FERRAND,C,2017,SMV,Beyond mice: Emerging and transdisciplinary models for the study of early-onset myopathies,SEM CELL D,10.1016/j.semcdb.2016.09.012
219209745P1,"Univ Blaise Pascal, Lab Math, F-63177 Aubiere, France",63177,AUBIERE,C,2017,SMV,Supercritical behavior of asymmetric zero-range process with sitewise disorder,ANN IHP-PR,10.1214/15-AIHP736
219210599P1,"Univ Clermont Auvergne, Inst Chim Clermont Ferrand, F-63178 Aubiere, France",63178,AUBIERE,C,2017,SMV,Molecular interactions and thermal transport in ionic liquids with carbon nanomaterials,PHYS CHEM P,10.1039/c7cp01952a
219210599P2,"CNRS, F-63178 Aubiere, France",63178,AUBIERE,NC,2017,SMV,Molecular interactions and thermal transport in ionic liquids with carbon nanomaterials,PHYS CHEM P,10.1039/c7cp01952a
219212405P3,"Univ Blaise Pascal, Lab Math UMR 6620, CNRS, F-63178 Aubiere, France",63178,AUBIERE,C,2017,SMV,Stability of periodic steady-state solutions to a non-isentropic Euler Poisson system,J DIFF EQUA,10.1016/j.jde.2017.02.002
219212900P1,"Univ Clermont Auvergne, CNRS, Chu Clermont Ferrand, ICCF,Sigma Clermont, F-63000 Clermont Ferrand, France",63000,CLERMONT-FERRAND,C,2017,SMV,Stability of an ophthalmic micellar formulation of cyclosporine A in unopened multidose eyedroppers and in simulated use conditions,EUR J PH SC,10.1016/j.ejps.2017.01.024
219212900P2,"Chu Clermont Ferrand, Pole Pharm, 58 Rue Montalembert,BP69, F-63000 Clermont Ferrand, France",63000,CLERMONT-FERRAND,C,2017,SMV,Stability of an ophthalmic micellar formulation of cyclosporine A in unopened multidose eyedroppers and in simulated use conditions,EUR J PH SC,10.1016/j.ejps.2017.01.024
219212900P3,"Chu Clermont Ferrand, Serv Ophtalmol, F-63000 Clermont Ferrand, France",63000,CLERMONT-FERRAND,C,2017,SMV,Stability of an ophthalmic micellar formulation of cyclosporine A in unopened multidose eyedroppers and in simulated use conditions,EUR J PH SC,10.1016/j.ejps.2017.01.024
219213129P1,"Univ Clermont Auvergne, Campus Univ Cezeaux,3 Pl Vasarely,TSA 60026, F-63178 Aubiere, France",63178,AUBIERE,C,2017,SMV,DEGENERATE FIRST-ORDER QUASI-VARIATIONAL INEQUALITIES: AN APPROACH TO APPROXIMATE THE VALUE FUNCTION,SIAM J CON,10.1137/15M1046083
219213256P4,"INRA, GDEC, F-63039 Clermont Ferrand, France",63039,CLERMONT-FERRAND,C,2017,SMV,Molecular epidemiology of Coxiella burnetii in French livestock reveals the existence of three main genotype clusters and suggests species-specific associations as well as regional stability,INFEC GENET,10.1016/j.meegid.2016.12.015
219213756P4,"Univ Clermont Auvergne, INRA, UNH, CRNH Auvergne, F-63000 Clermont Ferrand, France",63000,CLERMONT-FERRAND,C,2017,SMV,Vitamin D and walking speed in older adults: Systematic review and meta-analysis,MATURITAS,10.1016/j.maturitas.2017.07.012
219215349P1,"Univ Lyon, Lab Magmas & Volcans, UJM UCA CNRS IRD, 23 Rue Dr Paul Michelon, F-42023 St Etienne, France",42023,SAINT-ETIENNE,C,2017,SMV,"Cadomian S-type granites as basement rocks of the Variscan belt (Massif Central, France): Implications for the crustal evolution of the north Gondwana margin",LITHOS,10.1016/j.lithos.2017.06.001
219215349P9,"Univ Clermont Auvergne CNRS IRD, Lab Magmas & Volcans, OPGC, Campus Univ Cezeaux,6 Ave Blaise Pascal, F-63178 Aubiere, France",63178,AUBIERE,C,2017,SMV,"Cadomian S-type granites as basement rocks of the Variscan belt (Massif Central, France): Implications for the crustal evolution of the north Gondwana margin",LITHOS,10.1016/j.lithos.2017.06.001
219216634P23,"Univ Clermont Auvergne, LMGE, CNRS, UMR 6023, Campus Univ Cezeaux,Impasse Amelie Murat 1, F-63178 Aubiere, France",63178,AUBIERE,C,2017,SMV,Integrating chytrid fungal parasites into plankton ecology: research gaps and needs,ENVIRON MIC,10.1111/1462-2920.13827
219218863P1,"Univ Blaise Pascal, Univ Clermont Auvergne, Lab Math, BP 10448, F-63000 Clermont Ferrand, France",63000,CLERMONT-FERRAND,C,2017,SMV,A RESULT ON THE EQUATION x(p) + y(p) = z(r) USING FREY ABELIAN VARIETIES,P AM MATH S,10.1090/proc/13475
219218863P2,"CNRS, UMR 6620, LM, F-63171 Aubiere, France",63171,AUBIERE,C,2017,SMV,A RESULT ON THE EQUATION x(p) + y(p) = z(r) USING FREY ABELIAN VARIETIES,P AM MATH S,10.1090/proc/13475
219219457P2,"Univ Clermont Auvergne, Inst Pascal IMobS3, CNRS, SIGMA, F-63000 Clermont Ferrand, France",63000,CLERMONT-FERRAND,C,2017,SMV,Clothoids Composition Method for Smooth Path Generation of Car-Like Vehicle Navigation,J INTEL ROB,10.1007/s10846-017-0531-8
219219774P4,"Univ Auvergne, Dept Psychiat, CHU Clermont Ferrand, EA 7280, Clermont Ferrand, France",,CLERMONT-FERRAND,C,2017,SMV - SHS,Aggressiveness in depression: a neglected symptom possibly associated with bipolarity and mixed features,ACT PSYC SC,10.1111/acps.12777
219220321P1,"Univ Clermont Auvergne, LMBP, F-63000 Clermont Ferrand, France",63000,CLERMONT-FERRAND,C,2017,SMV,On some Euclidean properties of matrix algebras,J ALGEBRA,10.1016/j.jalgebra.2017.05.018
219220998P2,"Ctr Jean Perrin, Dept Pathol, F-63011 Clermont Ferrand, France",63011,CLERMONT-FERRAND,C,2017,SMV,Molecular Taxonomy and Signatures of Breast Cancer in 2017,ONCOLOGIE,10.1007/s10269-017-2700-6
219223158P1,"Univ Eloise Pascal, LIMOS CNRS UMR 6158, Campus Univ Cezeaux,2 Rue Chebarde,TSA 60125, F-63173 Aubiere, France",63173,AUBIERE,C,2017,SMV,A new extension of the RCPSP in a multi-site context: Mathematical model and metaheuristics,COM IND ENG,10.1016/j.cie.2017.07.028
219224171P1,"Univ Auvergne, Clermont Univ, EA 4678, CIDAM,CRNH Auvergne, F-63001 Clermont Ferrand, France",63001,CLERMONT-FERRAND,C,2017,SMV,Colonic Transit Time Is a Driven Force of the Gut Microbiota Composition and Metabolism: In Vitro Evidence,J NEUROG MO,10.5056/jnm16042
219224171P2,"INRA, UMR 1019, Plateforme Explorat Metab, Nutr Humaine, St Genes Champanelle, France",,SAINT-GENES-CHAMPANELLE,NC,2017,SMV,Colonic Transit Time Is a Driven Force of the Gut Microbiota Composition and Metabolism: In Vitro Evidence,J NEUROG MO,10.5056/jnm16042
219226353P2,"CHU, Serv Chirurg Digest, 1 Pl Lucie Aubrac, F-63003 Clermont Ferrand, France",63003,CLERMONT-FERRAND,C,2017,SMV,Surgeons-anesthetists relations: From an individual responsibility of the surgeon to a shared responsibility with the anesthetist,PRESSE MED,10.1016/j.lpm.2017.03.004
219228636P4,"Univ Blaise Pascal, Clermont Univ, Lab Genie Chim & Biochim, BP 10448, F-63000 Clermont Ferrand, France",63000,CLERMONT-FERRAND,C,2017,SMV,"Self-cycling fermentation for 1,3-propanediol production: Comparative evaluation of metabolite flux in cell recycling, simple batch and continuous processes using Lactobacillus brevis N1E9.3.3 strain",J BIOTECH,10.1016/j.jbiotec.2017.07.033
219229460P1,"CHU Estaing, Dept Gynecol Surg, 1 Pl Lucie Et Raymond Aubrac, F-63000 Clermont Ferrand, France",63000,CLERMONT-FERRAND,C,2017,SMV,Trauma and endometriosis. A review. May we explain surgical phenotypes and natural history of the disease?,J GYN OB HU,10.1016/j.jogoh.2016.12.008
219229709P1,"Univ Blaise Pascal, Univ Clermont Auvergne, Inst Pascal, BP 10448, F-63000 Clermont Ferrand, France",63000,CLERMONT-FERRAND,C,2017,SMV,Mixing and liquid-to-gas mass transfer under digester operating conditions,CHEM ENG SC,10.1016/j.ces.2017.01.056
219229709P2,"Univ Blaise Pascal, Univ Clermont Auvergne, Inst Pascal, LABEX IMobS3, BP 10448, F-63000 Clermont Ferrand, France",63000,CLERMONT-FERRAND,C,2017,SMV,Mixing and liquid-to-gas mass transfer under digester operating conditions,CHEM ENG SC,10.1016/j.ces.2017.01.056
219229709P3,"CNRS, UMR 6602, IP, F-63178 Aubiere, France",63178,AUBIERE,NC,2017,SMV,Mixing and liquid-to-gas mass transfer under digester operating conditions,CHEM ENG SC,10.1016/j.ces.2017.01.056
219229798P3,"Ctr Clermontois Rech Gest & Management CRCGM, Clermont Ferrand, France",,CLERMONT-FERRAND,C,2017,SHS,Understanding the Relationship between Inflation and Growth: A Wavelet Transformation Approach in the Case of Bangladesh,WORLD ECON,10.1111/twec.12429
219230356P3,"Univ Blaise Pascal, Lab Magmas & Volcans, CNRS, UMR 6524, 6 Ave Blaise Pascal, F-63038 Clermont Ferrand, France",63038,CLERMONT-FERRAND,C,2017,SMV,Timing and duration of partial melting and magmatism in the Variscan Montagne Noire gneiss dome (French Massif Central),INT J E SCI,10.1007/s00531-016-1417-x
219230944P9,"CHU Clermont Ferrand, Serv Hematol Clin Adultes, Site Estaing,1 Pl Lucie Aubrac, F-63003 Clermont Ferrand 1, France",630031,CLERMONT-FERRAND,C,2017,SMV,Chimerism analysis after hematopoietic cell transplantation: Guidelines from the Francophone Society of bone marrow transplantation and cellular therapy (SFGM-TC),B CANCER,10.1016/j.bulcan.2017.08.010
219231889P1,"Univ Clermont Auvergne, INRA, VetAgro Sup, UMR Herbivores, F-63122 St Genes Champanelle, France",63122,SAINT-GENES-CHAMPANELLE,C,2017,SMV,Production of trans and conjugated fatty acids in dairy ruminants and their putative effects on human health: A review,BIOCHIMIE,10.1016/j.biochi.2017.08.006
219231889P3,"Univ Clermont Auvergne, INRA, UNH, F-63000 Clermont Ferrand, France",63000,CLERMONT-FERRAND,C,2017,SMV,Production of trans and conjugated fatty acids in dairy ruminants and their putative effects on human health: A review,BIOCHIMIE,10.1016/j.biochi.2017.08.006
219231889P4,"CRNH Auvergne, F-63009 Clermont Ferrand, France",63009,CLERMONT-FERRAND,NC,2017,SMV,Production of trans and conjugated fatty acids in dairy ruminants and their putative effects on human health: A review,BIOCHIMIE,10.1016/j.biochi.2017.08.006
219233948P1,"Univ Clermont Auvergne, Inserm Neurodol U1107, Clermont Ferrand, France",,CLERMONT-FERRAND,C,2017,SMV,Ketamine Infusion Combined With Magnesium as a Therapy for Intractable Chronic Cluster Headache: Report of Two Cases,HEADACHE,10.1111/head.13135
219233948P2,"CHU Clermont Ferrand, Serv Neurol, Clermont Ferrand, France",,CLERMONT-FERRAND,C,2017,SMV,Ketamine Infusion Combined With Magnesium as a Therapy for Intractable Chronic Cluster Headache: Report of Two Cases,HEADACHE,10.1111/head.13135
219233948P3,"CHU Clermont Ferrand, Ctr Evaluat & Traitement Douleur, Clermont Ferrand, France",,CLERMONT-FERRAND,C,2017,SMV,Ketamine Infusion Combined With Magnesium as a Therapy for Intractable Chronic Cluster Headache: Report of Two Cases,HEADACHE,10.1111/head.13135
219237730P2,"Univ Blaise Pascal, Inst Pascal, Univ Clermont Auvergne, BP 10448, F-63000 Clermont Ferrand, France",63000,CLERMONT-FERRAND,C,2017,SMV,Kinetic Modeling of Pectin Extraction from Wasted Citrus Lemon L.,WAS BIO VAL,10.1007/s12649-016-9707-x
219237730P3,"CNRS, UMR 6602, IP, F-63178 Aubiere, France",63178,AUBIERE,NC,2017,SMV,Kinetic Modeling of Pectin Extraction from Wasted Citrus Lemon L.,WAS BIO VAL,10.1007/s12649-016-9707-x
